{
  "$schema": "./template.schema.json",
  "name": "Demo",
  "description": "This is an example of how to create a config template",
  "version": "1.0.0",
  "configs": [
    {
      "platform": "any",
      "service": {
        "name": "gh",
        "website": "https://github.com/{{ .Repo.FullName }}",
        "gitUrl": "git@github.com:{{ .Repo.FullName }}.git",
        "pattern": "*/*",
        "api": {
          "kind": "GitHub/v3",
          "url": "https://api.github.com"
        }
      }
    },
    {
      "platform": "windows",
      "app": {
        "name": "shell",
        "command": "powershell.exe"
      }
    },
    {
      "platform": "linux",
      "app": {
        "name": "shell",
        "command": "pwsh"
      }
    }
  ]
}